{
  "asset_type": "platform-strip",
  "outputs": [
    {
      "role": "runtime",
      "name": "bridge_left_cap",
      "path": "res://assets/generated/platform-strip/wood_bridge/bridge_left_cap.png",
      "godot_type": "Texture2D"
    },
    {
      "role": "runtime",
      "name": "bridge_repeat_middle",
      "path": "res://assets/generated/platform-strip/wood_bridge/bridge_repeat_middle.png",
      "godot_type": "Texture2D"
    },
    {
      "role": "runtime",
      "name": "bridge_right_cap",
      "path": "res://assets/generated/platform-strip/wood_bridge/bridge_right_cap.png",
      "godot_type": "Texture2D"
    }
  ],
  "sources": [
    {
      "path": "res://assets/generated/platform-strip/wood_bridge/bridge_left_cap.png",
      "layout": "single"
    },
    {
      "path": "res://assets/generated/platform-strip/wood_bridge/bridge_repeat_middle.png",
      "layout": "single"
    },
    {
      "path": "res://assets/generated/platform-strip/wood_bridge/bridge_right_cap.png",
      "layout": "single"
    }
  ],
  "previews": [],
  "validation": {
    "passed": true,
    "levels": {"L0": true, "L1": true, "L2": true, "L3": true, "L4": true}
  }
}
