{
  "asset_type": "portrait",
  "outputs": [
    {
      "role": "runtime",
      "name": "player_portrait",
      "path": "res://assets/generated/portrait/player_portrait/player_portrait.png",
      "godot_type": "Texture2D"
    }
  ],
  "sources": [
    {
      "path": "res://assets/generated/portrait/player_portrait/player_portrait.png",
      "layout": "single"
    }
  ],
  "previews": [],
  "validation": {
    "passed": true,
    "levels": {"L0": true, "L1": true, "L2": true, "L3": true, "L4": true}
  }
}
