{
  "asset_type": "ui-kit",
  "outputs": [
    {"role":"runtime","name":"main_theme","path":"res://assets/generated/ui-kit/adventure_hud/adventure_hud_theme.tres","godot_type":"Theme"},
    {"role":"runtime","name":"button_normal","path":"res://assets/generated/ui-kit/adventure_hud/button_normal.tres","godot_type":"StyleBoxTexture"},
    {"role":"runtime","name":"button_hover","path":"res://assets/generated/ui-kit/adventure_hud/button_hover.tres","godot_type":"StyleBoxTexture"},
    {"role":"runtime","name":"button_pressed","path":"res://assets/generated/ui-kit/adventure_hud/button_pressed.tres","godot_type":"StyleBoxTexture"},
    {"role":"runtime","name":"button_disabled","path":"res://assets/generated/ui-kit/adventure_hud/button_disabled.tres","godot_type":"StyleBoxTexture"},
    {"role":"runtime","name":"primary_normal","path":"res://assets/generated/ui-kit/adventure_hud/primary_normal.tres","godot_type":"StyleBoxTexture"},
    {"role":"runtime","name":"primary_hover","path":"res://assets/generated/ui-kit/adventure_hud/primary_hover.tres","godot_type":"StyleBoxTexture"},
    {"role":"runtime","name":"primary_pressed","path":"res://assets/generated/ui-kit/adventure_hud/primary_pressed.tres","godot_type":"StyleBoxTexture"},
    {"role":"runtime","name":"primary_disabled","path":"res://assets/generated/ui-kit/adventure_hud/primary_disabled.tres","godot_type":"StyleBoxTexture"},
    {"role":"runtime","name":"secondary_normal","path":"res://assets/generated/ui-kit/adventure_hud/secondary_normal.tres","godot_type":"StyleBoxTexture"},
    {"role":"runtime","name":"secondary_hover","path":"res://assets/generated/ui-kit/adventure_hud/secondary_hover.tres","godot_type":"StyleBoxTexture"},
    {"role":"runtime","name":"secondary_pressed","path":"res://assets/generated/ui-kit/adventure_hud/secondary_pressed.tres","godot_type":"StyleBoxTexture"},
    {"role":"runtime","name":"secondary_disabled","path":"res://assets/generated/ui-kit/adventure_hud/secondary_disabled.tres","godot_type":"StyleBoxTexture"},
    {"role":"runtime","name":"danger_normal","path":"res://assets/generated/ui-kit/adventure_hud/danger_normal.tres","godot_type":"StyleBoxTexture"},
    {"role":"runtime","name":"danger_hover","path":"res://assets/generated/ui-kit/adventure_hud/danger_hover.tres","godot_type":"StyleBoxTexture"},
    {"role":"runtime","name":"danger_pressed","path":"res://assets/generated/ui-kit/adventure_hud/danger_pressed.tres","godot_type":"StyleBoxTexture"},
    {"role":"runtime","name":"danger_disabled","path":"res://assets/generated/ui-kit/adventure_hud/danger_disabled.tres","godot_type":"StyleBoxTexture"},
    {"role":"runtime","name":"panel_base","path":"res://assets/generated/ui-kit/adventure_hud/panel_base.tres","godot_type":"StyleBoxTexture"},
    {"role":"runtime","name":"panel_raised","path":"res://assets/generated/ui-kit/adventure_hud/panel_raised.tres","godot_type":"StyleBoxTexture"},
    {"role":"runtime","name":"tab_selected","path":"res://assets/generated/ui-kit/adventure_hud/tab_selected.tres","godot_type":"StyleBoxTexture"},
    {"role":"runtime","name":"tab_hovered","path":"res://assets/generated/ui-kit/adventure_hud/tab_hovered.tres","godot_type":"StyleBoxTexture"},
    {"role":"runtime","name":"tab_unselected","path":"res://assets/generated/ui-kit/adventure_hud/tab_unselected.tres","godot_type":"StyleBoxTexture"},
    {"role":"runtime","name":"tooltip_panel","path":"res://assets/generated/ui-kit/adventure_hud/tooltip_panel.tres","godot_type":"StyleBoxTexture"},
    {"role":"runtime","name":"popup_menu_panel","path":"res://assets/generated/ui-kit/adventure_hud/popup_menu_panel.tres","godot_type":"StyleBoxTexture"},
    {"role":"runtime","name":"icon_left_arrow","path":"res://assets/generated/ui-kit/adventure_hud/icon_left_arrow.tres","godot_type":"AtlasTexture"},
    {"role":"runtime","name":"icon_right_arrow","path":"res://assets/generated/ui-kit/adventure_hud/icon_right_arrow.tres","godot_type":"AtlasTexture"},
    {"role":"runtime","name":"icon_up_arrow","path":"res://assets/generated/ui-kit/adventure_hud/icon_up_arrow.tres","godot_type":"AtlasTexture"},
    {"role":"runtime","name":"icon_down_arrow","path":"res://assets/generated/ui-kit/adventure_hud/icon_down_arrow.tres","godot_type":"AtlasTexture"},
    {"role":"runtime","name":"icon_back","path":"res://assets/generated/ui-kit/adventure_hud/icon_back.tres","godot_type":"AtlasTexture"},
    {"role":"runtime","name":"icon_close","path":"res://assets/generated/ui-kit/adventure_hud/icon_close.tres","godot_type":"AtlasTexture"},
    {"role":"runtime","name":"icon_confirm","path":"res://assets/generated/ui-kit/adventure_hud/icon_confirm.tres","godot_type":"AtlasTexture"},
    {"role":"runtime","name":"icon_warning","path":"res://assets/generated/ui-kit/adventure_hud/icon_warning.tres","godot_type":"AtlasTexture"},
    {"role":"runtime","name":"icon_information","path":"res://assets/generated/ui-kit/adventure_hud/icon_information.tres","godot_type":"AtlasTexture"},
    {"role":"runtime","name":"icon_settings","path":"res://assets/generated/ui-kit/adventure_hud/icon_settings.tres","godot_type":"AtlasTexture"},
    {"role":"runtime","name":"icon_add","path":"res://assets/generated/ui-kit/adventure_hud/icon_add.tres","godot_type":"AtlasTexture"},
    {"role":"runtime","name":"icon_remove","path":"res://assets/generated/ui-kit/adventure_hud/icon_remove.tres","godot_type":"AtlasTexture"},
    {"role":"runtime","name":"icon_lock","path":"res://assets/generated/ui-kit/adventure_hud/icon_lock.tres","godot_type":"AtlasTexture"},
    {"role":"runtime","name":"icon_unlock","path":"res://assets/generated/ui-kit/adventure_hud/icon_unlock.tres","godot_type":"AtlasTexture"},
    {"role":"runtime","name":"icon_checkbox_checked","path":"res://assets/generated/ui-kit/adventure_hud/icon_checkbox_checked.tres","godot_type":"AtlasTexture"},
    {"role":"runtime","name":"icon_checkbox_unchecked","path":"res://assets/generated/ui-kit/adventure_hud/icon_checkbox_unchecked.tres","godot_type":"AtlasTexture"},
    {"role":"runtime","name":"icon_radio_selected","path":"res://assets/generated/ui-kit/adventure_hud/icon_radio_selected.tres","godot_type":"AtlasTexture"},
    {"role":"runtime","name":"icon_radio_unselected","path":"res://assets/generated/ui-kit/adventure_hud/icon_radio_unselected.tres","godot_type":"AtlasTexture"},
    {"role":"runtime","name":"icon_submenu","path":"res://assets/generated/ui-kit/adventure_hud/icon_submenu.tres","godot_type":"AtlasTexture"},
    {"role":"runtime","name":"icon_status","path":"res://assets/generated/ui-kit/adventure_hud/icon_status.tres","godot_type":"AtlasTexture"},
    {"role":"runtime","name":"checkbox_unchecked","path":"res://assets/generated/ui-kit/adventure_hud/checkbox_unchecked.tres","godot_type":"AtlasTexture"},
    {"role":"runtime","name":"checkbox_checked","path":"res://assets/generated/ui-kit/adventure_hud/checkbox_checked.tres","godot_type":"AtlasTexture"},
    {"role":"runtime","name":"check_button_unchecked","path":"res://assets/generated/ui-kit/adventure_hud/check_button_unchecked.tres","godot_type":"AtlasTexture"},
    {"role":"runtime","name":"check_button_checked","path":"res://assets/generated/ui-kit/adventure_hud/check_button_checked.tres","godot_type":"AtlasTexture"},
    {"role":"runtime","name":"hslider_grabber","path":"res://assets/generated/ui-kit/adventure_hud/hslider_grabber.tres","godot_type":"AtlasTexture"},
    {"role":"runtime","name":"hslider_grabber_highlight","path":"res://assets/generated/ui-kit/adventure_hud/hslider_grabber_highlight.tres","godot_type":"AtlasTexture"},
    {"role":"runtime","name":"hslider_grabber_disabled","path":"res://assets/generated/ui-kit/adventure_hud/hslider_grabber_disabled.tres","godot_type":"AtlasTexture"},
    {"role":"runtime","name":"vslider_grabber","path":"res://assets/generated/ui-kit/adventure_hud/vslider_grabber.tres","godot_type":"AtlasTexture"},
    {"role":"runtime","name":"vslider_grabber_highlight","path":"res://assets/generated/ui-kit/adventure_hud/vslider_grabber_highlight.tres","godot_type":"AtlasTexture"},
    {"role":"runtime","name":"vslider_grabber_disabled","path":"res://assets/generated/ui-kit/adventure_hud/vslider_grabber_disabled.tres","godot_type":"AtlasTexture"},
    {"role":"runtime","name":"form_submenu_arrow","path":"res://assets/generated/ui-kit/adventure_hud/form_submenu_arrow.tres","godot_type":"AtlasTexture"}
  ],
  "sources": [
    {"path":"res://assets/generated/ui-kit/adventure_hud/theme_plan.json"},
    {"path":"res://assets/generated/ui-kit/adventure_hud/theme_recipe.json","layout":"theme_recipe"},
    {"path":"res://assets/generated/ui-kit/adventure_hud/source_sheet_plan.json"},
    {"path":"res://assets/generated/ui-kit/adventure_hud/stylebox_plan.json"},
    {"path":"res://assets/generated/ui-kit/adventure_hud/source_sheet_provenance.json"},
    {"path":"res://assets/generated/ui-kit/adventure_hud/surface_patches_source.png","layout":"grid_sheet"},
    {"path":"res://assets/generated/ui-kit/adventure_hud/icons_source.png","layout":"grid_sheet"},
    {"path":"res://assets/generated/ui-kit/adventure_hud/surface_patches_atlas.png","layout":"region_atlas"},
    {"path":"res://assets/generated/ui-kit/adventure_hud/icons_atlas.png","layout":"region_atlas"},
    {"path":"res://assets/generated/ui-kit/adventure_hud/surface_patches_atlas.json"},
    {"path":"res://assets/generated/ui-kit/adventure_hud/icons_atlas.json"},
    {"path":"res://assets/generated/ui-kit/adventure_hud/surface_patches_finalize_report.json"},
    {"path":"res://assets/generated/ui-kit/adventure_hud/icons_finalize_report.json"},
    {"path":"res://assets/generated/ui-kit/adventure_hud/surface_patches_process_report.json"},
    {"path":"res://assets/generated/ui-kit/adventure_hud/icons_process_report.json"}
  ],
  "previews": [],
  "validation": {"passed":true,"levels":{"L0":true,"L1":true,"L2":true,"L3":true,"L4":true}}
}
