{
  "asset_type": "fx-bundle",
  "outputs": [
    {
      "role": "runtime",
      "name": "pickup",
      "path": "res://assets/generated/fx-bundle/pickup/pickup.png",
      "godot_type": "Texture2D"
    }
  ],
  "sources": [
    {
      "path": "res://assets/generated/fx-bundle/pickup/pickup.png",
      "layout": "single"
    }
  ],
  "previews": [],
  "validation": {
    "passed": true,
    "levels": { "L0": true, "L1": true, "L2": true, "L3": true, "L4": true }
  }
}
