{
  "asset_type": "fx-bundle",
  "outputs": [
    {
      "role": "runtime",
      "name": "impact",
      "path": "res://assets/generated/fx-bundle/impact/impact.tres",
      "godot_type": "SpriteFrames"
    }
  ],
  "sources": [
    {
      "path": "res://assets/generated/fx-bundle/impact/impact_sheet.png",
      "layout": "grid_sheet"
    }
  ],
  "previews": [],
  "validation": {
    "passed": true,
    "levels": { "L0": true, "L1": true, "L2": true, "L3": true, "L4": true }
  }
}
