{
  "asset_type": "compact-prop-pack",
  "outputs": [
    {"role": "runtime", "name": "coin", "path": "res://assets/generated/compact-prop-pack/market-props/coin.tres", "godot_type": "AtlasTexture"},
    {"role": "runtime", "name": "crate", "path": "res://assets/generated/compact-prop-pack/market-props/crate.tres", "godot_type": "AtlasTexture"},
    {"role": "runtime", "name": "lantern", "path": "res://assets/generated/compact-prop-pack/market-props/lantern.tres", "godot_type": "AtlasTexture"}
  ],
  "sources": [
    {"path": "res://assets/generated/compact-prop-pack/market-props/market-props.png", "layout": "region_atlas"}
  ],
  "previews": [],
  "validation": {"passed": true, "levels": {"L0": true, "L1": true, "L2": true, "L3": true, "L4": true}}
}
