{
  "asset_type": "background-map",
  "outputs": [
    {
      "role": "runtime",
      "name": "forest_dawn",
      "path": "res://assets/generated/background-map/forest_dawn/forest_dawn.png",
      "godot_type": "Texture2D"
    }
  ],
  "sources": [
    {
      "path": "res://assets/generated/background-map/forest_dawn/forest_dawn.png",
      "layout": "single"
    }
  ],
  "previews": [],
  "validation": {
    "passed": true,
    "levels": {"L0": true, "L1": true, "L2": true, "L3": true, "L4": true}
  }
}
