{
  "asset_type": "platform-strip",
  "outputs": [
    {
      "role": "runtime",
      "name": "bridge_left_cap",
      "path": "res://assets/generated/platform-strip/wood_bridge/bridge_left_cap.tres",
      "godot_type": "AtlasTexture"
    },
    {
      "role": "runtime",
      "name": "bridge_repeat_middle",
      "path": "res://assets/generated/platform-strip/wood_bridge/bridge_repeat_middle.tres",
      "godot_type": "AtlasTexture"
    },
    {
      "role": "runtime",
      "name": "bridge_right_cap",
      "path": "res://assets/generated/platform-strip/wood_bridge/bridge_right_cap.tres",
      "godot_type": "AtlasTexture"
    }
  ],
  "sources": [
    {
      "path": "res://assets/generated/platform-strip/wood_bridge/wood_bridge.png",
      "layout": "region_atlas"
    }
  ],
  "previews": [],
  "validation": {
    "passed": true,
    "levels": {"L0": true, "L1": true, "L2": true, "L3": true, "L4": true}
  }
}
